<?xml version="1.0" encoding="UTF-8"?>

<book xmlns:xsi="http://www.w3.org/2001/XMLSchema-instance"
    xsi:noNamespaceSchemaLocation="guideBookSchema.xsd">
    <section name="Table of Contents" hasBookmark="true" bookmarkColor="CC0000">
        <page>
            <text x="0" y="10" alignment="center">Magki Books.
Published by Magki Books.
Copyright reserved. 
4th wall street, block road, block city, Blocksville (MC).
First published on 1276.
Copy 1020102393.
Author: Cyntain (I)

</text>
        </page>
        <page>
            <image x="8" y="0" width="100" height = "50">guidebooks/tomeOfArtificing.png</image>
<text x="0" y="53" alignment="center">-- Contents --
Artificing and Knowledge: P.2
Research Table discovery: P.6
After-thought: Disenchanter: P.12 </text>
        </page>
    </section>
    <section name="Artificing Table" hasBookmark="true" bookmarkColor="00CC00">
        <page>
            <text x="0" y="3" alignment="center">The Artificing Table</text>
		<text x="3" y="17">This table, is one of the most powerful tables in your collection. With your past knowledge of basic infusing, you are able to create powerful enchantments. 
 Although be warned this magic does come at a price. A vast amount of EXP is used in-order to infuse a rune with an item. The more runes you intend on infusing the greater the price you will pay.  </text>
        </page>
	
        <page>
		<text x="0" y="5" alignment="center">-- Construction --</text>
			<image x="32" y="15" width="50" height = "50">textures/gui/crafting.png</image>
	</page>
 	<page>
		<text x="2" y="3"> You should consider that the table doesn't have multiple uses, if you run out of symbols you can not use the table anymore. 
But never fear you can regain these symbols, you can use runes to regain symbols. Each level of rune gives back 3 symbols, EX:level 3 rune gives back 9 symbols.To use the runes on the table you must shift right click on the table, and you will notice that the symbols will reappear again.</text>
	</page>
	<page/>
	<page/>
    </section>
    <section name="Research Table" hasBookmark="true" bookmarkColor="F7D439">
        <page/>
        <page>
            <text x="0" y="3" lineWidth="113" alignment="right">Testing!</text>
        </page>
        <page/>       
        <page/>
        <page/>
    </section>
    <section name="Disenchanter" hasBookmark="true" bookmarkColor="8521FF">
        <page>
            <text x="0" y="10" alignment="center">Just some more testing!</text>
        </page>
        <page/>
        <page/>     
        <page>
            <text x="0" y="50" alignment="center">That's all folks!</text>
        </page>
    </section>
</book>